code,alt_label
INUK.792z.00,Coronary artery operations NOS
INUK.G618.00,"Intracerebral haemorrhage, multiple localized"
INUK.7A47.15,Other emergency bypass of superficial femoral artery
INUK.G664.00,Cerebellar stroke syndrome
INUK.G630.00,Basilar artery occlusion
INUK.7A4A100,Repair of popliteal artery NEC
INUK.7A12112,Dacron aortofemoral Y graft
INUK.7925.11,Creation of bypass from mammary artery to coronary artery
INUK.7A43000,Repair of iliac artery NEC
INUK.G30X000,Acute ST segment elevation myocardial infarction
INUK.G309.00,Acute Q-wave infarct
INUK.G31y300,Transient myocardial ischaemia
INUK.G65zz00,Transient cerebral ischaemia NOS
INUK.7927z00,Other open operation on coronary artery NOS
INUK.G360.00,Haemopericardium/current comp folow acut myocard infarct
INUK.G660.00,Middle cerebral artery syndrome
INUK.14AZ.00,H/O: CVS disease NOS
INUK.C107300,IDDM with peripheral circulatory disorder
INUK.G32..00,Old myocardial infarction
INUK.793G.00,Perc translumin balloon angioplasty stenting coronary artery
INUK.322..00,ECG: myocardial ischaemia
INUK.G653.00,Carotid artery syndrome hemispheric
INUK.7920z00,Saphenous vein graft replacement coronary artery NOS
INUK.M271400,Mixed venous and arterial leg ulcer
INUK.G667.00,Left sided CVA
INUK.G61X.00,"Intracerebral haemorrhage in hemisphere, unspecified"
INUK.662Kz00,Angina control NOS
INUK.C107400,NIDDM with peripheral circulatory disorder
INUK.G742600,Embolism and thrombosis of the anterior tibial artery
INUK.7921z00,Other autograft replacement of coronary artery NOS
INUK.7A43011,Repair of common iliac artery NEC
INUK.G631.12,"Thrombosis, carotid artery"
INUK.7A4B300,Percutaneous transluminal embolectomy of popliteal artery
INUK.G38z.00,"Postoperative myocardial infarction, unspecified"
INUK.7920200,Saphenous vein graft replacement of three coronary arteries
INUK.G740.12,Aortoiliac obstruction
INUK.G742500,Embolism and thrombosis of the popliteal artery
INUK.G742900,Embolism and thrombosis of a leg artery NOS
INUK.7928.11,Percutaneous balloon coronary angioplasty
INUK.R055000,[D]Failure of peripheral circulation
INUK.G732100,Gangrene of foot
INUK.793Gy00,OS perc translumina balloon angioplast stenting coronary art
INUK.9N0p.00,Seen in stroke clinic
INUK.G311z00,Preinfarction syndrome NOS
INUK.7920.11,Saphenous vein graft bypass of coronary artery
INUK.G702.00,Extremity artery atheroma
INUK.7A49100,Endarterectomy and patch repair of popliteal artery
INUK.7A4B900,Percutaneous transluminal insertion of stent femoral artery
INUK.323Z.00,ECG: myocardial infarct NOS
INUK.7A4A000,Repair of femoral artery NEC
INUK.G350.00,Subsequent myocardial infarction of anterior wall
INUK.8HBJ.00,Stroke / transient ischaemic attack referral
INUK.G34y100,Chronic myocardial ischaemia
INUK.7A4A.14,Other open operations on superficial femoral artery
INUK.7A49000,Endarterectomy and patch repair of femoral artery
INUK.SP07600,Coronary artery bypass graft occlusion
INUK.7A12111,Aorto bifemoral graft
INUK.7922100,Allograft replacement of two coronary arteries
INUK.Gyu6D00,[X]Sequelae/other + unspecified cerebrovascular diseases
INUK.R054200,[D]Gangrene of toe in diabetic
INUK.662K100,Angina control - poor
INUK.7A12312,Dacron aortoiliac Y graft
INUK.662K000,Angina control - good
INUK.G677300,Occlusion and stenosis of cerebellar arteries
INUK.C108G00,Insulin dependent diab mell with peripheral angiopathy
INUK.7A47000,Emerg bypass femoral art by fem/pop art anast c prosth NEC
INUK.C109F00,Non-insulin-dependent d m with peripheral angiopath
INUK.7A41300,Bypass iliac artery by femoral/femoral art anastomosis NEC
INUK.G311500,Acute coronary syndrome
INUK.Gyu6F00,"[X]Intracerebral haemorrhage in hemisphere, unspecified"
INUK.7A10300,Axillo-unifemoral PTFE bypass graft
INUK.Gyu6600,[X]Occlusion and stenosis of other cerebral arteries
INUK.G731000,Buerger's disease
INUK.G304.00,Posterior myocardial infarction NOS
INUK.792Bz00,Repair of coronary artery NOS